{
  "schemaVersion": "gov-208.context-bundle.v1",
  "status": "ok",
  "requestFingerprint": "1111111111111111111111111111111111111111111111111111111111111111",
  "policyFingerprint": "2222222222222222222222222222222222222222222222222222222222222222",
  "vaultFingerprint": "3333333333333333333333333333333333333333333333333333333333333333",
  "notes": [
    {
      "noteId": "gov210-live-note",
      "relativePath": "private/gov210-live-note.md",
      "depth": 0,
      "metadata": {
        "noteId": "gov210-live-note",
        "admissionStatus": "proposed",
        "source": "/private/source/gov210-live-note.md",
        "aspectRefs": ["aspect:live"]
      },
      "excerpt": "private text must not enter housing",
      "contentSha256": "4444444444444444444444444444444444444444444444444444444444444444",
      "links": []
    }
  ],
  "exclusions": [],
  "diagnostics": [],
  "bundleFingerprint": "a109c832d30152e9707078fbf32d25cec634616a6d26b46c226bae054b806fee"
}
